{
  "schema_version": 1,
  "stable_id": "com.lalzart.ksoloti.extended.effects.comb-network",
  "id": "comb-network",
  "uuid": "9d6f002b-813b-5bc1-8502-02fc3b08e2e2",
  "description": "Four nested, cross-coupled feedback comb lines with damping and stereo decorrelation. Tags: effect, comb, feedback-network, resonator, spatial, stereo, heavy.",
  "author": "Lance Ship",
  "license": "GPL-3.0-or-later",
  "ports": {"inlets": [{"name": "input", "type": "frac32buffer.bipolar", "description": "mono excitation"}], "outlets": [{"name": "left", "type": "frac32buffer.bipolar", "description": "left network output"}, {"name": "right", "type": "frac32buffer.bipolar", "description": "right network output"}]},
  "parameters": [
    {"id": "com.lalzart.ksoloti.extended.effects.comb-network.size", "name": "size", "type": "frac32.u.map", "default": "40"},
    {"id": "com.lalzart.ksoloti.extended.effects.comb-network.feedback", "name": "feedback", "type": "frac32.u.map", "default": "48"},
    {"id": "com.lalzart.ksoloti.extended.effects.comb-network.damping", "name": "damping", "type": "frac32.u.map", "default": "28"},
    {"id": "com.lalzart.ksoloti.extended.effects.comb-network.spread", "name": "spread", "type": "frac32.u.map", "default": "42"},
    {"id": "com.lalzart.ksoloti.extended.effects.comb-network.mix", "name": "mix", "type": "frac32.u.map", "default": "32"}
  ],
  "implementation": {"header": "comb_network_dsp.h", "class_name": "KsolotiExtendedCombNetworkDSP", "instance_name": "engine", "init_method": "Init", "process_method": "Process", "rate": "krate", "arguments": ["inlet_input", "param_size", "param_feedback", "param_damping", "param_spread", "param_mix", "outlet_left", "outlet_right", "BUFSIZE"]},
  "resources": {"max_voices": 1, "state_bytes": 16416, "scratch_bytes": 64, "bounded_work_per_block": 3072},
  "compatibility": {"tier": "core-heavy", "build_status": "offline-verified", "tested_targets": ["host-c++17", "ksoloti-core@1.1.0"], "notes": "Portable tests and the combined audio-effects Cortex-M4 link passed; feedback-tail CPU and sound remain board checks."},
  "tests": ["startup-silent", "dry-path", "impulse-tail", "feedback-bound", "finite-output"]
}
